{
  "$schema": "https://json-schema.org/draft/2020-12/schema",
  "$id": "https://trustguard.local/contracts/v1/knowledge_resource.schema.json",
  "title": "TrustGuard Knowledge Resource v1",
  "type": "object",
  "additionalProperties": false,
  "required": [
    "schema_version",
    "scope",
    "content_revision",
    "resource_ref",
    "source_revision",
    "content_hash",
    "text",
    "source_type",
    "visibility",
    "metadata"
  ],
  "properties": {
    "schema_version": {
      "const": "trustguard-knowledge-resource-v1"
    },
    "scope": {
      "type": "string",
      "minLength": 1,
      "maxLength": 64
    },
    "content_revision": {
      "type": "string",
      "minLength": 1,
      "maxLength": 128
    },
    "resource_ref": {
      "type": "string",
      "minLength": 1,
      "maxLength": 2048,
      "pattern": "^krf1\\."
    },
    "source_revision": {
      "type": "integer",
      "minimum": 1
    },
    "content_hash": {
      "type": "string",
      "pattern": "^sha256:[a-f0-9]{64}$"
    },
    "document_id": {
      "type": ["string", "null"],
      "maxLength": 128
    },
    "experience_id": {
      "type": ["string", "null"],
      "maxLength": 128
    },
    "text": {
      "type": "string",
      "minLength": 1,
      "maxLength": 32000
    },
    "title": {
      "type": ["string", "null"],
      "maxLength": 512
    },
    "filename": {
      "type": ["string", "null"],
      "maxLength": 512
    },
    "page_no": {
      "type": ["integer", "null"],
      "minimum": 1
    },
    "source_uri": {
      "type": ["string", "null"],
      "maxLength": 2048
    },
    "source_type": {
      "enum": ["document", "experience", "playbook"]
    },
    "workflow_type": {
      "type": ["string", "null"],
      "maxLength": 64
    },
    "effectiveness": {
      "type": ["string", "null"],
      "enum": [null, "unknown", "promising", "effective", "ineffective"]
    },
    "visibility": {
      "enum": ["global", "workspace"]
    },
    "metadata": {
      "type": "object"
    }
  }
}
